{
  "format": "vt-job/1",
  "network": "local",
  "name": "defaults filled in",
  "message": "A synthetic vt fixture message.\nIt has two lines.\n",
  "chains": {
    "eth": {
      "mode": "drain",
      "distinctCopies": true,
      "keyAddress": "0x8739Eb87B3d11f221Df63454F8D229a1A4F4049C",
      "budgetUsd": 10,
      "maxTipGwei": 3,
      "clawbackTo": null
    },
    "sol": {
      "mode": {
        "copies": 3
      },
      "distinctCopies": true,
      "keyAddress": "9xx7qC7uwTAeaSo7T5Gk9canYBosFh1pMQaDmQEa83Tb",
      "budgetUsd": 5,
      "maxCuPrice": 2000000,
      "clawbackTo": "G147qVmzynHL3EjQ8tvBGDms7u6FDCWbFfFmzNMZmg1x"
    }
  }
}
