{
  "format": "vt-job/1",
  "network": "local",
  "name": "message by digest",
  "chains": {
    "eth": {
      "mode": "drain",
      "publishMode": "eth.calldata.null",
      "feeStrategy": "passive",
      "distinctCopies": true,
      "keyAddress": "0x8739Eb87B3d11f221Df63454F8D229a1A4F4049C",
      "budgetUsd": 10,
      "maxTipGwei": 3,
      "clawbackTo": null
    }
  },
  "messageSha256": "ee3d6ce1f65081ef7d4ba1d47f3fa0af53bf627f1d91048a6151fde91da9f5dc",
  "messageBytes": 514
}
