{
  "format": "vt-job/1",
  "network": "local",
  "name": "eth drain to the null address",
  "message": "A synthetic vt fixture message.\nIt has two lines.\n",
  "chains": {
    "eth": {
      "mode": "drain",
      "publishMode": "eth.calldata.null",
      "feeStrategy": "passive",
      "distinctCopies": true,
      "keyAddress": "0x8739Eb87B3d11f221Df63454F8D229a1A4F4049C",
      "budgetUsd": 10,
      "maxTipGwei": 3,
      "clawbackTo": null
    }
  },
  "arweaveCopy": false
}
